titulo,precio,provincia,lugar,num_dormitorios,num_banos,area,num_garages,tipo_precio_lugar
ARRIENDO AMPLIA CASA EN EL SECTOR DE CONOCOTO,940,Pichincha,"pichincha, conocoto, quito, ecuador",3,4,840.0,1,Medio
RENTA AMPLIO DEPARTAMENTO SECTOR ELOY ALFARO,550,Pichincha,"pichincha, av. eloy alfaro, quito, ecuador",3,2,132.0,1,Económico
LOCAL DE ARRIENDO TORRES SANTA FE 6 DE DICIEMBRE,750,Pichincha,"pichincha, av. 6 de diciembre, quito, ecuador",3,2,135.0,1,Medio
TERRENO EN BALCONES DE TAPAILA – ESMERALDAS,7000,Esmeraldas,"esmeraldas, balcones de tapaila, troncal del pacifico, ecuador",3,2,100.0,1,Medio
"RENTO 2DO PISO DE EDIF 3 AMBIENTES, SANGOLQUI",1200,Pichincha,"pichincha, sangolqui, sangolqui, ecuador",3,2,395.0,1,Lujo
Arriendo Departamento 3 dormitorios,350,Pichincha,"pichincha, asuncion & canada, quito, ecuador",3,2,120.0,1,Medio
CASA EN EL SECTOR DE LA ARMENIA LA RIBERA,1800,Pichincha,"pichincha, la armenia, quito, ecuador",3,3,485.0,5,Medio
DEPARTAMENTO EN RENTA SEMI AMOBLADO QUITO TENNIS,700,Pichincha,"pichincha, quito tenis, quito, ecuador",2,1,85.0,1,Medio
EN RENTA DEPARTAMENTO DE 3 HAB. CENTRO HISTORICO,280,Pichincha,"pichincha, centro historico, quito, ecuador",3,1,95.0,1,Económico
"ARRIENDO OFICINA, BODEGA, DEPARTAMENTO",3000,Pichincha,"pichincha, la gasca, quito, ecuador",5,2,1500.0,1,Lujo
"Quito Tenis, Exclusivo y bello depto de 90 M2",500,Pichincha,"pichincha, los cabildos 112, quito, ecuador",2,2,90.0,2,Medio
Hermoso departamento de arriendo sector Ponceano alto 3 dormitorios $450 incluido Alicuota,450,Pichincha,"pichincha, ponceano alto, quito, ecuador",3,2,120.0,1,Medio
Hermosa casa de arriendo de oportunidad sector La Pampa $600,600,Pichincha,"pichincha, la pampa, quito, ecuador",3,3,140.0,2,Medio
RENTO OFICINA CON O SIN MENAJE EL COLIBRI SANGOLQU,900,Pichincha,"pichincha, sangolqui, sangolqui, ecuador",3,2,98.0,1,Medio
RENTO OFICINAS EN PLAZA COLIBRI SANGOLQUI 88M2,690,Pichincha,"pichincha, sangolqui, sangolqui, ecuador",3,2,88.0,1,Medio
RENTO OFICINAS EN PLAZA COLIBRI SANGOLQUI 86M2,675,Pichincha,"pichincha, sangolqui, sangolqui, ecuador",3,2,86.0,1,Medio
Alquila la oficina para tu negocio en Yaruquí,450,Pichincha,"pichincha, yaruqui, quito, ecuador",3,2,180.0,1,Medio
RENTO OFICINAS EN PLAZA COLIBRI SECTOR SANGOLQUI,705,Pichincha,"pichincha, sangolqui, sangolqui, ecuador",3,2,90.0,1,Medio
Departamento en Renta en el Sector de La Kennedy,280,Pichincha,"pichincha, la kennedy, quito, ecuador",2,1,70.0,1,Medio
Departamento de Arriendo en Ponceano,250,Pichincha,"pichincha, calles orianga n63-159 y de los cedros.",2,1,65.0,1,Medio
RENTA EXCLUSIVO DEPARTAMENTO EDF. BÔ QUITO TENNIS,900,Pichincha,"pichincha, quito tenis, quito, ecuador",3,2,120.0,2,Medio
EN RENTA DEPARTAMENTO SECTOR 6 DE DICIEMBRE,550,Pichincha,"pichincha, av. 6 de diciembre, quito, ecuador",3,2,90.0,1,Económico
RENTA CASA – 150m2 – EL CONDADO,450,Pichincha,"pichincha, rio pucuno & rio bigal, quito, ecuador",3,2,150.0,2,Medio
RENTA SUITE – 55m2 – EL INCA,350,Pichincha,"pichincha, avenida de las palmeras & de los madronos, quito, ecuador",1,1,55.0,1,Medio
RENTA DEPARTAMENTO – 120m2 -LA CAROLINA,690,Pichincha,"pichincha, el comercio & el tiempo, quito 170102, ecuador",3,1,120.0,1,Medio
EN RENTA LOCAL DE 6M2 SECTOR COLIBRÍ LOCAL 5,190,Pichincha,"pichincha, el colibri, avenida general ruminahui, sangolqui, ecuador",3,2,6.0,1,Económico
RENTO LOCALES COMERCIALES UBICADOS SECTOR COLIBRÍ LOCAL 4,420,Pichincha,"pichincha, el colibri, avenida general ruminahui, sangolqui, ecuador",3,2,12.0,1,Medio
RENTO LOCAL COMERCIAL PLANTA BAJA SECTOR COLIBRÍ LOCAL 3,1090,Pichincha,"pichincha, el colibri, avenida general ruminahui, sangolqui, ecuador",3,2,162.0,1,Lujo
RENTO LOCALES COMERCIALES UBICADOS SECTOR COLIBRÍ LOCAL 2,665,Pichincha,"pichincha, el colibri, avenida general ruminahui, sangolqui, ecuador",3,2,108.0,1,Lujo
RENTO LOCALES COMERCIALES UBICADOS SECTOR COLIBRÍ LOCAL 1,655,Pichincha,"pichincha, el colibri, avenida general ruminahui, sangolqui, ecuador",3,2,106.0,1,Medio
RENTO LOCALES COMERCIALES UBICADOS SECTOR COLIBRÍ,585,Pichincha,"pichincha, el colibri, avenida general ruminahui, sangolqui, ecuador",3,2,95.0,35,Medio
"ARRIENDO DEPARTAMENTO CON EXCELENTE UBICACIÓN, 2 HABITACIONES, AMOBLADO O SIN AMOBLAR, $5OO",500,Pichincha,"pichincha, juan montalvo n2-168 y, quito 170157, ecuador",2,1,70.0,1,Medio
ARRIENDO DEPARTAMENTO CON EXCELENTE UBICACIÓN.,650,Pichincha,"pichincha, cumbaya, ecuador",3,2,180.0,2,Medio
SE RENTA DEPARTAMENTO EN CONJUNTO EN CONOCOTO,370,Pichincha,"pichincha, conocoto, quito, ecuador",3,2,100.0,1,Económico
Departamento en Renta sector La Carolina,350,Pichincha,"pichincha, la carolina, quito, ecuador",3,1,100.0,1,Medio
DEPARTAMENTO EN RENTA SECTOR KENNEDY,415,Pichincha,"pichincha, la kennedy, quito, ecuador",3,2,103.0,2,Lujo
En Arriendo bonita Oficina Sector La Pradera,700,Pichincha,"pichincha, la pradera, quito, ecuador",3,2,94.0,1,Lujo
Habitación en Renta en el Sector la Carolina hab. 2,120,Pichincha,"pichincha, la carolina, quito, ecuador",1,1,15.0,1,Económico
RENTA OFICINA- 60m2 – CENTRO NORTE DE QUITO,470,Pichincha,"pichincha, batan bajo, quito, ecuador",3,1,60.0,1,Económico
LOCAL DE ARRIENDO EN LAS CASAS QUITO,490,Pichincha,"pichincha, las casas, quito, ecuador",3,2,70.0,1,Medio
DEPARTAMENTO EN ALQUILER SECTOR PINAR BAJO,550,Pichincha,"pichincha, teniente homero salas, quito, ecuador",3,3,150.0,1,Medio
Departamento en Renta sector La Carolina,350,Pichincha,"pichincha, la carolina, quito, ecuador",3,1,90.0,1,Medio
"SUITE AMOBLADA DE ARRIENDO , SECTOR LA CAROLINA",750,Pichincha,"pichincha, avenida de los shyris & avenida naciones unidas, quito, ecuador",1,2,72.0,1,Medio
EN RENTA-LOCAL COMERCIAL SECTOR VERSALLES,200,Pichincha,"pichincha, versalles, quito, ecuador",3,2,30.0,1,Económico
"Arriendo Departamento 3 Dormitorios + Estudio, Mañosca",450,Pichincha,"pichincha, manosca & avenida occidental, quito, ecuador",3,3,130.0,1,Lujo
"Arriendo Departamento 2 Dormitorios, Mañosca",350,Pichincha,"pichincha, manosca & avenida occidental, quito, ecuador",2,2,105.0,1,Económico
ARRIENDO OFICINA-142m2-REPÚBLICA DEL SALVADOR,900,Pichincha,"pichincha, av. republica de el salvador, quito 170102, ecuador",3,2,142.0,2,Medio
Departamento sector República del Salvador,700,Pichincha,"pichincha, finlandia n36-83 y suecia",3,3,178.0,2,Medio
ARRIENDO BODEGA Y OFICINAS. ESQUIENERO. (BELLAVISTA DE CALDERÓN),900,Pichincha,"pichincha, bellavista, quito, ecuador",4,3,646.0,1,Lujo
ARRIENDO OFICINA-142m2-REPÚBLICA DEL SALVADOR,900,Pichincha,"pichincha, av. republica de el salvador, quito, ecuador",3,2,142.0,2,Medio
RENTA DEPARTAMENTO – 115m3 – SAN RAFAEL,383,Pichincha,"pichincha, av. gral. ruminahui & isla floreana, quito, ecuador",2,3,115.0,1,Medio
RENTA MODERNA OFICINA – 96m2 – LA CORUÑA,480,Pichincha,"pichincha, av. la coruna & san ignacio, quito, ecuador",3,2,96.0,1,Medio
Hermoso departamento embajada Americana (colegio SEK) edificio inteligente $500,500,Pichincha,"pichincha, av. avigiras, av. eloy alfaro e12-170 y, quito 170124, ecuador",3,2,100.0,1,Medio
Hermoso departamento Edificio inteligente sector Ponceano Alto,400,Pichincha,"pichincha, ponceano alto, quito, ecuador",2,2,100.0,1,Medio
Hermosa casa 3 platas sector embajada Américana,480,Pichincha,"pichincha, embajada americana, quito, ecuador",3,2,100.0,2,Medio
Alquiler de Departamento 2do Piso Alto en Garzota Norte de Guayaquil,400,Guayas,"guayas, garzota ii, guayaquil, ecuador",2,1,68.0,1,Medio
AMPLIA HERMOSA CASA ARRIENDO MITAD DEL MUNDO QUITO,350,Pichincha,"pichincha, padre rumi e1-10, quito, ecuador",5,4,170.0,1,Medio
"ARIENDO DEPARTAMENTO DUPLEX CONJUNTO SOL DEL SUR, QUITUMBE",220,Pichincha,"pichincha, av. condor nan, quito, ecuador",3,2,100.0,1,Medio
TERRENOS DE VENTA A 10 MINUTOS DE LA PLAYA,7840,Esmeraldas,"esmeraldas, atacames, ecuador",3,2,100.0,1,Medio
"Arriendo Consultorio Medico, La Mariscal",280,Pichincha,"pichincha, la mariscal, quito, ecuador",3,1,43.0,1,Económico
"Arriendo Departamento 2 Dormitorios, Casablanca",140,Esmeraldas,"esmeraldas, casablanca, same",2,2,80.0,1,Medio
Suite en renta sector Granda Centeno,450,Pichincha,"pichincha, granda centeno, quito, ecuador",1,1,68.0,1,Medio
"Arriendo Departamento 4 Dormitorios + Estudio, Gonzalez Suarez",1000,Pichincha,"pichincha, gonzalez suarez, quito, ecuador",4,6,285.0,2,Lujo
Hermoso departamento con Terraza propia de arriendo sector Ponceano Alto,400,Pichincha,"pichincha, ponceano, ecuador",3,2,140.0,1,Económico
Linda Casa de oportunidad $380 sector Ponceano alto,380,Pichincha,"pichincha, ponceano alto, quito, ecuador",3,2,100.0,1,Medio
"Hermosa Casa de Arriendo en Mirasierra, Valle de Los Chillos",500,Pichincha,"pichincha, mirasierra, quito, ecuador",3,3,140.0,2,Medio
Hermoso departamento de arriendo sector Ponceano Alto  2 dormitorios,380,Pichincha,"pichincha, ponceano alto, quito, ecuador",2,2,80.0,1,Medio
Hermoso departamento de arriendo el bosque 2 dormitorios,500,Pichincha,"pichincha, el bosque, quito, ecuador",2,2,100.0,1,Medio
"Se arrienda departamento en Cumbaya, sector la Primavera.",1200,Pichincha,"pichincha, cumbaya, quito, ecuador",2,3,130.0,2,Medio
AMPLIA Y HERMOSA CASA DE RENTA EN SAN RAFAEL,1400,Pichincha,"pichincha, san rafael, ecuador",4,2,473.0,1,Lujo
"Arriendo Bodega, sector Ana Maria Bajo, Occidental",590,Pichincha,"pichincha, ana maria bajo, quito, ecuador",3,1,175.0,1,Medio
Se Renta Amplio Departamento en el Sector de la Unión Nacional Cerca del Centro Comercial el Bosque,690,Pichincha,"pichincha, marcos jofre, quito, ecuador",4,4,230.0,1,Medio
Arriendo departamento en San Carlos frente al parque ingles,250,Pichincha,"pichincha, av. mariscal sucre, quito, ecuador",3,2,80.0,1,Medio
Arriendo Departamento Amoblado 2 Dorm. Centro Histórico,650,Pichincha,"pichincha, centro historico, quito, ecuador",2,3,114.0,1,Medio
"Arriendo Departamento Amoblado 3 Dorm. + Servicio, El Batán Bajo",600,Pichincha,"pichincha, el batan, quito, ecuador",3,3,115.0,1,Medio
"Vendo Terrenos de 200m2 Listos Para Construir en Cayo Beach, Avista Las Ballenas Jorobadas en Puerto Cayo, Jipijapa, Manabí, Ecuador; Ventas: +593987213710",3840,Manabí,"manabi, puerto cayo, ecuador",1,1,100.0,1,Económico
"Vendo Terreno en Lotización Cayo Beach con: Agua, Luz, Calles Lastradas, Piscinas, Áreas Bbq, Playa de Puerto Cayo, Jipijapa, Manabí; Llámame: 0987213710",5400,Manabí,"manabi, puerto cayo, ecuador",1,1,100.0,1,Lujo
Alquiler dpto. totalmente amoblado,750,Guayas,"guayas, cdla. cogra frente a miraflores",2,1,120.0,1,Medio
"ARRIENDO DEPARTAMENTO, SECTOR QUICENTRO NORTE",610,Pichincha,"pichincha, quicentro shopping, avenida 6 de diciembre, quito, ecuador",3,2,110.0,2,Lujo
Se arrienda hermosa casa en la Viña,2500,Pichincha,"pichincha, cumbaya, quito, ecuador",4,5,400.0,4,Medio
"Arriendo Suite Amoblada, Granda Centeno",280,Pichincha,"pichincha, granda centeno, quito, ecuador",1,1,50.0,1,Económico
"TU LOTE A 3 CUADRAS DE LA PLAYA DE PUERTO CAYO, JIPIJAPA, MANABI Y CONSTRUYA SU CASA PARA VACACIONAR, LOTIZACIÓN CAYO BEACH CERCA DE LOS FRAILES Y PUERTO LOPEZ; CONTACTANOS: 0987213710",6000,Manabí,"manabi, puerto cayo playa, puerto cayo, ecuador",1,1,100.0,1,Medio
VENTA DE SOLARES EN LOTIZACIÓN CAYO BEACH UBICADA EN PUERTO CAYO UNA DE LAS PLAYAS MAS HERMOSAS DE LA REGION COSTA DEL ECUADOR; WHATSAPP: 0987213710,6000,Manabí,"manabi, puerto cayo playa, puerto cayo, ecuador",1,1,100.0,1,Medio
"TERRENOS EN PUERTO CAYO LUGAR IDEAL PARA EL DESCANSO Y VACACIONAR, TERRENOS DE 180M2 A $5.400 CON SERVICIOS BASICOS Y AREAS RECREATIVAS; WHATSAPP: +593987213710",5400,Manabí,"manabi, puerto cayo playa, puerto cayo, ecuador",1,1,100.0,1,Medio
"INVIERTE EN LA PLAYA EN PUERTO CAYO, JIPIJAPA, MANABI, LOTES DE 180M2 A 5.400 USD EN LOTIZACIÓN PRIVADA CAYO BEACH, ESCRITURAS INMEDIATAS; VENTAS: 0987213710",5400,Manabí,"manabi, puerto cayo playa, puerto cayo, ecuador",1,1,100.0,1,Medio
Bodega de Arriendo Centro Norte de Quito Sector Hospital Metropolitano,650,Pichincha,"pichincha, cuero y caicedo, quito, ecuador",1,1,300.0,1,Lujo
RENTO LOCAL COMERCIAL EN VERSALLES Y PORTOVIEJO,390,Pichincha,"pichincha, versalles, quito, ecuador",3,1,30.0,1,Lujo
"EN RENTA, LOCAL COMERCIAL EN EL SEC. LOS TULIPANES",170,Pichincha,"pichincha, cotocollao, quito, ecuador",3,1,20.0,1,Económico
SE ARRIENDA LOCAL COMERCIAL EN LA PRIMAVERA,800,Pichincha,"pichincha, la primavera, quito, ecuador",3,2,80.0,3,Lujo
DEPARTAMENTO EN ARRIENDO 230 $ QUITO – NORTE DE QUITO – EL CONDADO – PRADOS DEL CONDADO,230,Pichincha,"pichincha, el condado, quito, ecuador",3,2,100.0,1,Lujo
Departamento en Renta sector La Kennnedy,300,Pichincha,"pichincha, la kennedy, quito, ecuador",3,2,386.0,1,Medio
HERMOSOS DEPARTAMENTO EN RENTA SECTOR QUITO NORTE,350,Pichincha,"pichincha, cotocollao, quito, ecuador",3,1,80.0,1,Lujo
EN RENTA OFICINA EJECUTIVA ESTADIO OLIMPICO,452,Pichincha,"pichincha, inaquito, quito, ecuador",3,2,100.0,1,Medio
OFICINA EJECUTIVA EN RENTA ESTADIO OLIMPICO ATAHUA,218,Pichincha,"pichincha, inaquito, quito, ecuador",3,2,40.0,1,Económico
OFICINA EJECUTIVA EN RENTA EN IÑAQUITO,260,Pichincha,"pichincha, inaquito, quito, ecuador",3,2,21.0,1,Económico
SUITE CON PATIO PONCEANO ALTO / SUPERMAXI,350,Pichincha,"pichincha, calle 3 & francisco dalmau, quito, ecuador",1,2,67.0,1,Medio
SE RENTA LOCAL COMERCIAL -SECTOR CONOCOTO,1000,Pichincha,"pichincha, conocoto, quito, ecuador",3,1,90.0,1,Lujo
DEPARTAMENTO EN ARRIENDO 210 $ – NORTE DE QUITO – EL CONDADO – URBANIZACIÓN PRADOS DEL CONDADO,210,Pichincha,"pichincha, el condado, quito, ecuador",3,2,90.0,1,Económico
DEPARTAMENTO EN GUAYAQUIL EN CIUDADEL ALBORADA 3ERA ETAPA DETRAZ DE PLAZA MAYOR PARA PERSONA SOLA O PAREJA SIN MASCOTAS,250,Guayas,"guayas, alborada iii etapa, guayaquil, ecuador",1,1,100.0,1,Medio
HERMOSO DEPARTAMENTO AMOBLADO EN RENTA / NORUEGA,900,Pichincha,"pichincha, noruega, quito, ecuador",3,2,106.0,1,Medio
Arriendo Local Comercial sector Andalucía,1800,Pichincha,"pichincha, andalucia, quito, ecuador",3,2,290.0,3,Lujo
Departamento de Arriendo sector Andalucía,390,Pichincha,"pichincha, andalucia, quito, ecuador",2,1,100.0,1,Económico
Alquilo amplio consultorio en sector de la antigua Maternidad Enrique Sotomayor,900,Guayas,"guayas, pedro pablo gomez",6,4,190.0,1,Medio
Hermoso departamento duplex de arriendo sector Ponceano alto de oportunidad,500,Pichincha,"pichincha, ponceano alto, quito, ecuador",3,3,120.0,2,Lujo
Hermoso departamento de arriendo de oportunidad sector el bosque 3 dormitorios,550,Pichincha,"pichincha, el bosque, quito, ecuador",3,2,100.0,2,Medio
Hermoso departamento de arriendo de oportunidad 3 dormitorios Ponceano alto $400,400,Pichincha,"pichincha, ponceano alto, quito, ecuador",3,3,100.0,1,Medio
Hermoso departamento de arriendo de oportunidad sector Shyris Carolina,500,Pichincha,"pichincha, avenida de los shyris, quito, ecuador",2,2,85.0,1,Medio
Hermosa suite amoblada de arriendo de oportunidad sector Portugal,500,Pichincha,"pichincha, portugal, quito, ecuador",1,2,75.0,1,Medio
Bello departamento de alquiler en Mocoli,2300,Guayas,"guayas, isla mocoli, samborondon, ecuador",3,1,220.0,2,Medio
Hermosa casa de arriendo de oportunidad sector Pomasqui,380,Pichincha,"pichincha, pomasqui, quito, ecuador",3,3,130.0,2,Medio
DEPARTAMENTO EN ARRIENDO $215 NORTE DE QUITO – EL CONDADO – PRADOS DEL CONDADO,215,Pichincha,"pichincha, el condado, quito, ecuador",3,1,90.0,1,Medio
Suite amoblada sector La Carolina Av Shyris,450,Pichincha,"pichincha, luxemburgo & holanda, quito, ecuador",1,1,40.0,1,Medio
SE RENTA PROPIEDAD COMERCIAL SECTOR LA DELICIA,5000,Pichincha,"pichincha, la delicia, quito, ecuador",3,6,1850.0,1,Medio
LOCAL COMERCIAL VENTA/RENTA,900,Pichincha,"pichincha, av. mariana de jesus, la pradera, quito, ecuador",3,2,120.0,1,Medio
ARRIENDO OFICINA SECTOR LA SHYRIS,390,Pichincha,"pichincha, av. de los shyris, quito, ecuador",3,2,50.0,1,Económico
"ARRIENDO LOCAL PUEMBO, SERVICIOS MÉDICOS,DENTALES",350,Pichincha,"pichincha, puembo, ecuador",3,2,100.0,1,Lujo
RENTO DEPARTAMENTO 2 DORM.SECTOR REP. DEL SALVADOR,550,Pichincha,"pichincha, av republica de el salvador, quito, ecuador",2,1,95.0,1,Lujo
Hermoso departamento de arriendo amoblado sector el bosque,500,Pichincha,"pichincha, el bosque, quito, ecuador",3,2,115.0,1,Medio
Tv: Se Renta suite vacia Sector El Inca,300,Pichincha,"pichincha, de los madronos, quito, ecuador",1,2,74.0,1,Medio
Tv: ARRIENDO DEPARTAMENTO SECTOR NORTE ELOY ALFARO – QUITO,350,Pichincha,"pichincha, monteserrin, quito, ecuador",2,2,90.0,1,Económico
Tvc: Arriendo departamento 2 dormitorios sector Tumbaco,230,Pichincha,"pichincha, av. intervalles, quito, ecuador",2,1,67.0,1,Medio
Tv: Arriendo departamento 3 dormitorios sector Caminos del Sur,290,Pichincha,"pichincha, santa rita, quito 170131, ecuador",3,3,145.0,1,Medio
Tv: Rento departamento 2 dormitorios sector Andalucia,210,Pichincha,"pichincha, andalucia, quito 170104, ecuador",2,1,65.0,1,Medio
Tv: Arriendo departamento 3 dormitorios sector Iñaquito,550,Pichincha,"pichincha, inaquito",3,3,110.0,1,Medio
ALQUILO OFICINA EN EDIFICIO TRADE BUILDING,600,Guayas,"guayas, avenida jose joaquin de olmedo, guayaquil, ecuador",3,1,50.0,1,Medio
ALQUILO OFICINA CON AIRE ACONDICIONADO EN KENNEDY NORTE,720,Guayas,"guayas, kennedy norte, guayaquil, ecuador",3,1,72.0,1,Lujo
"Arriendo Departamento, 3 dormitorios amplios, Sector Eloy Alfaro entre los Guayacanes y Fresnos",420,Pichincha,"pichincha, de los guayacanes & de los fresnos, quito, ecuador",3,2,110.0,1,Medio
ARRIENDO DEPARTAMENTO OCCIDENTAL SECTOR ANT,250,Pichincha,"pichincha, torres constelacion, quito, ecuador",2,1,62.0,1,Medio
Renta 2 dormitorios amoblado de lujo Republica del Salvador centro norte,900,Pichincha,"pichincha, avenida republica de el salvador, quito, ecuador",2,2,120.0,1,Económico
OFICINA RENTA -SECT. IÑAQUITO ED.AMAZONAS,500,Pichincha,"pichincha, inaquito, quito, ecuador",3,2,54.0,1,Medio
ARRIENDO OFICINA – SEC. IÑAQUITO BCO. AMAZONAS,500,Pichincha,"pichincha, inaquito, quito, ecuador",3,2,30.0,1,Medio
ARRIENDO CASA AMOBLADA OFICINAS-SECTOR RUMIÑAHUI,1000,Pichincha,"pichincha, de los cedros, quito, ecuador",3,2,224.0,1,Medio
SE ARRIENDA BONITO LOCAL COMERCIAL (AV. ILALO),325,Pichincha,"pichincha, av ilalo, quito, ecuador",3,2,70.0,1,Medio
SE ARRIENDA BONITO LOCAL COMERCIAL LA MAGDALENA,550,Pichincha,"pichincha, la magdalena, quito, ecuador",3,2,120.0,1,Medio
Rento departamento dúplex González Suárez,1000,Pichincha,"pichincha, gonzalez suarez",2,3,190.0,2,Medio
SE ARRIENDA LOCAL EN IÑAQUITO,450,Pichincha,"pichincha, inaquito, quito, ecuador",3,2,45.0,1,Medio
SE ALQUILA OFICINA DE IÑAQUITO,400,Pichincha,"pichincha, inaquito, quito, ecuador",3,1,25.0,1,Medio
"Rento Casa Hermosa, Cumbaya, Seguridad, Conjunto, Amplios Jardines Comunales",880,Pichincha,"pichincha, el chaquinan, cumbaya, quito, ecuador",3,4,153.0,2,Medio
Renta o venta hermoso y elegante departamento Miravalle Urbanización,1200,Pichincha,"pichincha, miravalle, quito, ecuador",3,3,145.0,2,Medio
RENTO CASA MUY MODERNA Y ELEGANTE TANDA,3500,Pichincha,"pichincha, plaza del rancho, eugenio espejo, quito 170157, ecuador",4,4,450.0,4,Medio
Rento hermoso departamento rústico URBANIZACIÓN TANDA,1200,Pichincha,"pichincha, nayon tanda eugenio espejo",2,3,225.0,2,Medio
RENTO HERMOSA SUITE A ESTRENAR CUMBAYÁ LA PRIMAVERA,600,Pichincha,"pichincha, leonardo davinci, cumbaya, quito, ecuador",1,2,60.0,1,Medio
TERRENO EN RENTA EN CALDERON,450,Pichincha,"pichincha, calderon, quito, ecuador",3,2,100.0,1,Económico
ARRIENDO OFICINA SECTOR LA CAROLINA,650,Pichincha,"pichincha, inaquito, quito, ecuador",3,2,64.0,1,Lujo
OFICINA EJECUTIVA EN RENTA REPUBLICA DEL SALVADOR,1300,Pichincha,"pichincha, avenida republica de el salvador, quito, ecuador",3,2,164.0,2,Lujo
EN RENTA TERRENO PLANO SAN ANTONIO DE PICHINCHA,450,Pichincha,"pichincha, san antonio de pichincha, quito, ecuador",3,2,100.0,1,Económico
EN RENTA DEPARTAMENTO LA FLORIDA,280,Pichincha,"pichincha, la concepcion, quito, ecuador",3,2,70.0,1,Económico
OFICINAS DE ARRIENDO SECTOR LA CONCEPCIÓN,350,Pichincha,"pichincha, la concepcion, quito, ecuador",3,2,66.0,1,Lujo
Hermoso departamento de arriendo de oportunidad sector Granados UDLA,500,Pichincha,"pichincha, de los granados, quito, ecuador",3,3,110.0,1,Económico
"Arriendo casa en Juan Procel, Norte de Quito, sector El Condado",350,Pichincha,"pichincha, juan procel, quito, ecuador",3,3,130.0,1,Medio
LOCAL EN RENTA VIA PRINCIPAL AL AEROPUERTO,500,Pichincha,"pichincha, pifo, ecuador",3,2,70.0,1,Económico
LOCAL EN RENTA VIA PRINCIPAL PIFO,1200,Pichincha,"pichincha, pifo, ecuador",3,2,300.0,1,Lujo
Hermoso departamento de arriendo sector La Catolica,470,Pichincha,"pichincha, avenida isabel la catolica, quito, ecuador",2,2,80.0,1,Medio
Rento cómodo departamento sector Los Laureles,400,Pichincha,"pichincha, los laureles, quito, ecuador",3,3,100.0,1,Medio
OFICINA EN RENTA – AMOBLADA,380,Pichincha,"pichincha, mariana de jesus & la pradera, quito, ecuador",3,1,48.0,2,Medio
Arriendo casa Condado Juan Procel Norte de Quito,550,Pichincha,"pichincha, juan procel, quito 170134, ecuador",4,4,175.0,2,Medio
Hermoso departamento de oportunidad sector Granados (UDLA),380,Pichincha,"pichincha, av. eloy alfaro & de los granados, quito 170513, ecuador",3,2,100.0,1,Medio
Bodega en Arriendo sector Sangolquí,270,Pichincha,"pichincha, sangolqui, ecuador",3,2,22.0,1,Medio
Arriendo departamento sur de Quito,100,Pichincha,"pichincha, nueva aurora, quito, ecuador",2,1,60.0,1,Medio
Departamento Dúplex en renta sector la América,650,Pichincha,"pichincha, av. america & san gabriel, quito, ecuador",4,2,177.0,1,Medio
Local Comercial en renta sector Capelo local 1,230,Pichincha,"pichincha, capelo, quito, ecuador",3,2,45.0,1,Medio
120 M2 CASA AMOBLADA RENTA SALGOLQUI JUNTO AL IESS,500,Pichincha,"pichincha, sangolqui, ecuador",3,2,120.0,1,Medio
ARRIENDO TERRENO COMERCIAL AV. PRINCIPAL GEOVANNY CALLES MARIANITAS CALDERON,360,Pichincha,"pichincha, san patricio, calderon, quito, ecuador",3,2,8.0,1,Medio
Hermoso departamento de arriendo de oportunidad Ponceano Alto $370,370,Pichincha,"pichincha, ponceano alto, quito, ecuador",3,2,110.0,1,Económico
Hermosa suite departamento en arriendo Pinar Alto,430,Pichincha,"pichincha, el pinar alto, quito, ecuador",1,2,70.0,1,Medio
Hermoso departamento de arriendo sector 6 de Diciembre y Gonzáles Suarez,500,Pichincha,"pichincha, gonzalez suarez, quito, ecuador",3,3,120.0,2,Medio
Se arrienda hermosa suite amoblada Ponceano alto,350,Pichincha,"pichincha, ponceano alto, quito, ecuador",1,1,70.0,1,Económico
Hermosa casa de arriendo de oportunidad $450 Ponceano alto,450,Pichincha,"pichincha, ponceano alto, quito, ecuador",3,3,140.0,2,Medio
Hermoso departamento de arriendo de oportunidad $380 sector Ponceano alto tres dormitorios,380,Pichincha,"pichincha, ponceano alto, quito, ecuador",3,2,135.0,2,Medio
Rento cómodo y seguro departamento en San Carlos,240,Pichincha,"pichincha, machala y vaca de castro, quito, ecuador",2,1,100.0,1,Medio
"Rento casa, sector Ponceano",450,Pichincha,"pichincha, ponciano alto, quito, ecuador",3,3,127.0,1,Económico
"ALQUILO CASA DE 2 PLANTAS MALAGA 2, VIA SALITRE",400,Guayas,"guayas, salitre 5, guayaquil, ecuador",3,3,105.0,2,Medio
RENTO DPTO. 3 DORMITORIOS EN LA JIPIJAPA,450,Pichincha,"pichincha, isla isabela, quito, ecuador",3,3,136.0,1,Medio
AMPLIO PATIO ESQUINERO EN ZONA COMERCIAL,700,Pichincha,"pichincha, avenida alonso de angulo, quito, ecuador",3,2,80.0,1,Medio
ARRIENDO LOCAL AMPLIO EN LA VILLAFLORA,700,Pichincha,"pichincha, av alonso de angulo, quito, ecuador",3,1,100.0,1,Medio
"LOTES PARA SU CASA VACACIONAL PLAYERA O PARA SU VIVIENDA PERMANENTE, DENTRO DE LOTIZACIÓN PRIVADA EN PUERTO CAYO A 30 MINUTOS DE PUERTO LOPEZ; VENTAS: +593987213710",6000,Manabí,"manabi, playa de puerto cayo, jipijapa, manabi",3,2,100.0,1,Medio
Alquiler de Departamento 3 dormitorios Urb. Parque Magno,1200,Guayas,"guayas, parque magno, avenida los arrozales, samborondon, ecuador",3,3,139.0,2,Medio
Alquilo Bodega 212 mts via a Daule,954,Guayas,"guayas, via a daule, guayaquil, ecuador",3,2,212.0,1,Medio
SUITE BOSMEDIANO RENTA,520,Pichincha,"pichincha, jose bosmediano, quito, ecuador",1,2,70.0,1,Económico
"Arriendo Quinta a 10 minutos del Aeropuerto Internacional Sucre, Sector Tumbaco Arenal Hilacryl",1000,Pichincha,"pichincha, rio san pedro e4-325 y rio chiche",4,3,500.0,10,Medio
Moderno Departamento/Suite Amoblado Sector La Carolina,540,Pichincha,"pichincha, edificio atelier, avenida 6 de diciembre, quito, ecuador",1,2,80.0,1,Medio
Suite Amoblada de Lujo en la Shyris,450,Pichincha,"pichincha, de los shyris y portugal, quito, ecuador",1,1,50.0,1,Medio
"Alquiler hermoso departamento 2 dormitorios. Sector embajada americana, solca, norte de Quito.",340,Pichincha,"pichincha, avigiras & de los cholanes, quito, ecuador",2,2,85.0,1,Medio
"Alquiler hermosa suite amoblada Av. República de El Salvador, norte de Quito",430,Pichincha,"pichincha, av republica de el salvador, quito, ecuador",1,1,65.0,1,Económico
"Alquiler departamento 3 dormitorios en San Pedro Claver, Av. La Prensa y Fernandez Salvador, norte de Quito",310,Pichincha,"pichincha, av. dr. jose fernandez salvador, quito, ecuador",3,1,90.0,1,Medio
Rento Suite 75 metros sector Republica del Salvador,450,Pichincha,"pichincha, av. portugal & av republica de el salvador, quito 170102, ecuador",1,2,75.0,1,Medio
"ARRIENDO DEPARTAMENTO 3 DORMITORIOS, SECTOR UNIVERSIDAD CATÓLICA,",420,Pichincha,"pichincha, avenue 12 de octubre 1076, quito 170143, ecuador",3,2,110.0,1,Medio
Alquilo 2 Departamentos grandes de 4 dormitorios Sector El Bosque,720,Pichincha,"pichincha, el bosque, quito, ecuador",4,3,230.0,2,Lujo
Vendo o arriendo Departamento en El Condado Vicolinci,600,Guayas,"guayas, el condado vicolinci, avenida leon febres cordero ribadeneyra, ecuador",2,3,121.0,2,Medio
