titulo,precio,provincia,lugar,num_dormitorios,num_banos,area,num_garages,tipo_precio_lugar
Hermoso departamento de arriendo sector iñaquito,500,Pichincha,"pichincha, inaquito, quito, ecuador",2,2,95.0,1,Medio
Hermosa suite de arriendo sector iñaquito,375,Pichincha,"pichincha, quito, ecuador",1,1,65.0,1,Económico
Hermoso departamento de oportunidad de arriendo sector Republica del Salvador,650,Pichincha,"pichincha, av. republica de el salvador, quito 170135, ecuador",2,2,120.0,1,Medio
Hermoso departamento de arriendo de 240 metros Ponceano alto 3 dormitorios $560,560,Pichincha,"pichincha, albert einstein, quito, ecuador",3,3,240.0,2,Económico
Hermoso departamento de arriendo de oportunidad en la urbanizacion El Condado,580,Pichincha,"pichincha, urbanizacion el condado, calle c, quito, ecuador",3,4,128.0,2,Medio
Hermosa suite de arriendo de oportunidad sector Quito Tenis,460,Pichincha,"pichincha, quito tenis, quito, ecuador",1,1,58.0,1,Medio
Hermoso departamento en renta sector Quito Tenis,435,Pichincha,"pichincha, quito tenis, quito 170104, ecuador",2,2,98.0,1,Económico
Hermoso departamento de arriendo en la Urb. El condado,750,Pichincha,"pichincha, vgw2+q5j, quito 170134, ecuador",3,3,190.0,1,Medio
Hermosa suite amoblada de arriendo sector Quito Tenis,570,Pichincha,"pichincha, quito tenis, quito 170104, ecuador",1,1,61.0,1,Medio
Hermoso departamento en renta/venta sector Quito Tenis,1800,Pichincha,"pichincha, quito tenis, quito 170104, ecuador",4,3,380.0,3,Lujo
Hermosa suite de arriendo de oportunidad sector Quito Tenis,500,Pichincha,"pichincha, quito tenis, quito 170104, ecuador",1,1,70.0,1,Medio
Hermoso departamento de arriendo sector Santa Lucía dos dormitorios de oportunidad,360,Pichincha,"pichincha, santa lucia, quito, ecuador",2,2,105.0,1,Económico
Hermoso departamento de arriendo sector Catolica 3 dormitorios de oportunidad,560,Pichincha,"pichincha, catolica, quito, ecuador",3,3,120.0,1,Medio
Hermoso departamento de arriendo duplex ponceano alto,450,Pichincha,"pichincha, ponceano alto, quito, ecuador",3,3,130.0,1,Medio
Hermosa casa de arriendo de oportunidad sector Santa Lucía 3 dormitorios,550,Pichincha,"pichincha, santa lucia, quito, ecuador",3,3,140.0,2,Medio
Hermoso departamento de arriendo de oportunidad 3 dormitorios Ponceano alto,400,Pichincha,"pichincha, ponceano alto, quito, ecuador",3,2,105.0,1,Medio
Hermoso departamento de arriendo de oportunidad sector Monteserrin 2 dormitorios,400,Pichincha,"pichincha, monteserrin, quito, ecuador",2,2,90.0,1,Medio
Casa en renta con patio! Casa de arriendo Pomasqui 3 dormitorios 2 plantas,400,Pichincha,"pichincha, pomasqui, quito, ecuador",3,3,100.0,2,Medio
Hermosa casa de arriendo sector Ponceano colegio Einstein,600,Pichincha,"pichincha, ponceano alto, quito, ecuador",4,3,130.0,2,Lujo
Hermoso departamento de arriendo sector Carolina Alianza Francesa,550,Pichincha,"pichincha, la carolina, quito, ecuador",3,2,110.0,1,Medio
Hermoso departamento de arriendo de oportunidad sector Quicentro Megamaxi,500,Pichincha,"pichincha, quicentro shopping, avenida de los shyris, quito, ecuador",2,2,100.0,1,Económico
Hermoso departamento de arriendo amoblado González Suárez,600,Pichincha,"pichincha, gonzalez suarez, quito, ecuador",2,3,90.0,1,Medio
Hermoso departamento de arriendo sector El Bosque,690,Pichincha,"pichincha, el bosque, quito, ecuador",3,2,120.0,1,Medio
Hermosa suite amoblada de arriendo sector Quito Tennis,450,Pichincha,"pichincha, quito tenis, quito, ecuador",1,2,75.0,1,Económico
"Departamento de Arriendo , Excelente Ubicación",600,Pichincha,"pichincha, av. eloy alfaro, quito, ecuador",3,2,160.0,1,Lujo
Hermoso Departamento de Arriendo con vista espectacular y ubicación excepcional,700,Pichincha,"pichincha, av. eloy alfaro en la ciudad de quito",3,3,150.0,2,Medio
"Arriendo Excelente Departamento Con 3 Terrazas, Sector Granda Centeno",1200,Pichincha,"pichincha, juan jose de villalengua, quito, ecuador",4,4,350.0,2,Medio
Se arrienda local comercial grande,600,Pichincha,"pichincha, machachi, ecuador",3,2,90.0,1,Medio
Amplio Local de Arriendo Con Ubicación Privelegiada,8000,Pichincha,"pichincha, av. de los shyris, quito, ecuador",3,9,1000.0,13,Lujo
Local Comercial de Renta en Excelente ubicación,1200,Pichincha,"pichincha, av. de los shyris, quito, ecuador",3,1,100.0,1,Medio
DEPARTAMENTO DE 3 DORMITORIOS EN PONCEANO,460,Pichincha,"pichincha, mariano paredes, quito, ecuador",3,2,115.0,2,Medio
Arriendo Bonito Departamento Sector Bosmediano,550,Pichincha,"pichincha, jose bosmediano, quito, ecuador",3,2,92.0,2,Lujo
Rento Penthouse Sector norte de Quito,2000,Pichincha,"pichincha, luxemburgo, quito, ecuador",5,5,300.0,3,Medio
Suite amoblada Av.Diego de Almagro y Juan Severino,680,Pichincha,"pichincha, diego de almagro, quito, ecuador",1,2,51.0,1,Medio
SE ARRIENDA MINIDEPARTAMENTO NORTE DE QUITO,115,Pichincha,"pichincha, comite del pueblo, quito, ecuador",3,1,80.0,1,Medio
“Rento amplio departamento en la Carolina”,520,Pichincha,"pichincha, av. atahualpa & inaquito, quito, ecuador",3,2,150.0,1,Medio
“Rento departamento en sector la Carolina”,750,Pichincha,"pichincha, catalina de aldaz & av. portugal, quito, ecuador",2,2,87.0,1,Medio
"“Rento Departamento Amoblado, Sector La Carolina”",1390,Pichincha,"pichincha, catalina de aldaz & avenida portugal, quito, ecuador",3,3,126.0,1,Medio
“Rento Oficina-Consultorio en la Marina de Jesús”,520,Pichincha,"pichincha, calle b & san gabriel, quito, ecuador",3,2,84.0,2,Medio
RENTO DEPARTAMENTO EN EL CONJUNTO SAN MARTIN,450,Pichincha,"pichincha, hernandez de giron & pedregal, quito, ecuador",2,1,69.0,1,Medio
"En Renta Casa en Conj Terracota B, Sangolquí",350,Pichincha,"pichincha, conjunto habitacional terracota b, venezuela, sangolqui, ecuador",2,2,90.0,1,Medio
"LOCAL COMERCIAL EN ARRIENDO, AV.6 DE DIC. -QUITO",1200,Pichincha,"pichincha, av. 6 de diciembre, quito, ecuador",3,2,186.0,1,Lujo
"RENTA HERMOSO DEPARTAMENTO DÚPLEX, USHIMANA",380,Pichincha,"pichincha, ushimana, quito, ecuador",3,2,145.0,2,Medio
OFICINAS EN RENTA SECTOR REPÚBLICA DEL SALVADOR,2800,Pichincha,"pichincha, av. republica del salvador & moscu, quito, ecuador",3,3,216.0,3,Medio
EN RENTA LOCAL COMERCIAL SECTOR COLIBRÍ SANGOLQUÍ,800,Pichincha,"pichincha, el colibri, avenida general ruminahui, sangolqui, ecuador",3,2,101.0,2,Lujo
"OFICINAS DE RENTA 143 M2, SECTOR IÑAQUITO",650,Pichincha,"pichincha, av. gaspar de villarroel & av. amazonas, quito, ecuador",3,2,143.0,1,Medio
EN RENTA LOCAL COMERCIAL SECTOR COLIBRÍ SANGOLQUÍ,800,Pichincha,"pichincha, del colibri, sangolqui, ecuador",3,2,100.0,1,Medio
AMPLIAS BODEGAS DE RENTA PUSUQUÍ SECTOR 4 ESQUINAS,380,Pichincha,"pichincha, av. manuel cordova galarza, quito, ecuador",3,2,90.0,1,Lujo
LOCAL U OFICINA DE RENTA PUSUQUÍ SECTOR 4 ESQUINAS,180,Pichincha,"pichincha, av. manuel cordova galarza, quito, ecuador",3,1,15.0,1,Económico
AMPLIO LOCAL COMERCIAL DE RENTA PUSUQUÍ,350,Pichincha,"pichincha, av. manuel cordova galarza, quito, ecuador",3,2,32.0,1,Medio
DEPARTAMENTO DE 2 DORMITORIOS SECTOR LA PRADERA,550,Pichincha,"pichincha, diego de almagro & alpallana, quito, ecuador",2,1,72.0,2,Lujo
REACTIVA TU NEGOCIO- CENTRO DE LATACUNGA,120,Cotopaxi,"cotopaxi, latacunga, ecuador",3,2,48.0,1,Medio
Arriendo Galpón Industrial/ Bodega. Sector Parques del Recuerdo Norte,2800,Pichincha,"pichincha, juncal, quito, ecuador",3,2,954.0,1,Medio
RENTO DEPARTAMENTO DE 2 DORMITORIOS,350,Pichincha,"pichincha, de las frutillas, quito, ecuador",2,2,74.0,1,Medio
Arriendo local comercial dúplex en La Mariscal,1600,Pichincha,"pichincha, diego de almagro & la pinta, quito, ecuador",3,2,75.0,1,Medio
ARRIENDO SUITE AMOBLADA EN EL QUITO TENIS,750,Pichincha,"pichincha, quito tenis, quito, ecuador",1,1,125.0,1,Medio
Quieres rentar consultorio Hospital de los Valles?,350,Pichincha,"pichincha, av. interoceanica, quito, ecuador",3,2,43.0,1,Medio
DEPARTAMENTO TRES DORMITORIOS SECTOR EL BOSQUE,650,Pichincha,"pichincha, av. brasil & el condor, quito, ecuador",3,3,190.0,2,Medio
¿Buscas rentar un departamento en Mastodontes?,350,Pichincha,"pichincha, av jaime roldos aguilera, quito, ecuador",3,1,125.0,1,Medio
Arriendo consultorio en la Clínica Pichincha,350,Pichincha,"pichincha, avenida general ignacio de veintimilla & 9 de octubre, quito, ecuador",3,2,30.0,1,Medio
"TERRENO EN RENTA 3350 M2, SAN ANTONIO DE PICHINCHA",1200,Pichincha,"pichincha, san antonio de pichincha, quito, ecuador",3,2,3350.0,1,Lujo
EN RENTA – ÁREA COMERCIAL VÍA AMAGUAÑA TAMBILLO,150,Pichincha,"pichincha, tambillo, ecuador",3,2,143.0,3,Medio
"CASA DE ARRIENDO 189 M2, SECTOR DE CONOCOTO",1000,Pichincha,"pichincha, polit lasso, quito, ecuador",5,3,180.0,1,Medio
Departamento Amplio en el Norte de Quito,350,Pichincha,"pichincha, jorge piedra y gonzalo gallo, quito, ecuador",4,3,100.0,1,Medio
LOCAL EN RENTA SAN ISIDRO la California Alta y E16 Conjunto Mirador de Amagasí,200,Pichincha,"pichincha, california alta & calle e16, conjunto habitacional mirador de amagasi, quito, ecuador",3,1,23.0,1,Medio
"OFICINAS DE ARRIENDO 200 M2, SECTOR IÑAQUITO",1500,Pichincha,"pichincha, avenida gaspar de villaroel & japon, quito, ecuador",3,2,200.0,4,Medio
LOCAL COMERCIAL DE ARRIENDO 80 M2 SECTOR AMERICA,400,Pichincha,"pichincha, buenos aires & estados unidos, quito, ecuador",3,2,80.0,1,Medio
Departamento Amplio en el Norte de Quito,380,Pichincha,"pichincha, callde de los guabos y de las cucardas, sector el inca",3,2,120.0,1,Medio
Local en Renta Terracota,450,Pichincha,"pichincha, sangolqui, ecuador",3,1,110.0,1,Medio
Hermoso departamento Remodelado centro norte,480,Pichincha,"pichincha, sector mariana de jesus, calle nuno de valderrama y mariana de jesus",2,3,115.0,1,Medio
DEPARTAMENTO EN RENTA EN LA DIEGO DE ALMAGRO,100,Pichincha,"pichincha, whymper & diego de almagro, quito 170517, ecuador",2,2,1.0,1,Medio
ARRIENDO OFICINA EN SANGOLQUI VALLE DE LOS CHILLOS,230,Pichincha,"pichincha, sangolqui, ecuador",3,1,53.0,1,Económico
"RENTA AMPLIO DEPARTAMENTO 3D, ORIENTE QUITEÑO",1500,Pichincha,"pichincha, quiteno libre & fernando ayarza, quito, ecuador",3,4,196.0,2,Medio
SUITE AMOBLADA DE RENTA TUMBACO,650,Pichincha,"pichincha, tumbaco, quito, ecuador",1,1,70.0,1,Medio
"OFICINAS DE ARRIENDO 210 M2, SECTOR COMERCIAL NORTE",500,Pichincha,"pichincha, cuero y caicedo, quito, ecuador",3,2,210.0,2,Económico
"RENTA AMPLIO LOCAL 225 m2 DUPLEX, EDIFICIO FORESTA",1800,Pichincha,"pichincha, alonso de torres & av. edmundo carvajal, quito 170132, ecuador",3,2,253.0,3,Medio
BODEGA DE ARRIENDO 500m2 EN EL INCA BUENOS AIRES,1350,Pichincha,"pichincha, san isidro del inca, quito, ecuador",3,2,500.0,4,Medio
HERMOSA Y CONFORTABLE CASA EN RENTA LA PAMPA,600,Pichincha,"pichincha, la pampa, quito, ecuador",3,2,137.0,2,Medio
EXCELENTE DEPARTAMENTO SECTOR “QUICENTRO SHOPPING”,600,Pichincha,"pichincha, quicentro shopping, avenida 6 de diciembre, quito, ecuador",4,3,240.0,2,Económico
"EN RENTA DEPARTAMENTO, CONJUNTO DIVINO NIÑO",120,Pichincha,"pichincha, turubamaba, ecuador",2,1,48.0,1,Medio
ARRIENDO BODAGA EN EL SECTOR DE FAJARDO,1300,Pichincha,"pichincha, avenida puruhaes, quito, ecuador",3,2,324.0,5,Medio
ARRIENDO BODEGA EN EL SECTOR DE FAJARDO,1300,Pichincha,"pichincha, avenida puruhaes, quito, ecuador",3,2,324.0,1,Medio
SUITE AMOBLADA DE ALQUILER EN LA PRADERA,550,Pichincha,"pichincha, la pradera, quito, ecuador",1,1,72.0,1,Económico
duplex en arriendo puente dos,400,Pichincha,"pichincha, autopista general ruminahui, quito, ecuador",4,5,300.0,1,Medio
ARRIENDO MINI DEPARTAMENTO EN PUERTO FRANCISCO DE ORELLANA,150,Orellana,"orellana, san sebastian del coca, ecuador",1,1,28.0,2,Medio
Hermosa casa de arriendo sector Ponceano de oportunidad $580,580,Pichincha,"pichincha, albert einstein, quito, ecuador",3,3,180.0,2,Lujo
Hermoso departamento de arriendo sector Ponceano alto 3 dormitorios de oportunidad $380,380,Pichincha,"pichincha, ponceano alto, quito, ecuador",3,3,110.0,1,Medio
Casa en arriendo Los Ceibos Ibarra,480,Imbabura,"imbabura, calle rio chimbo 7-63 y rio palora",4,3,140.0,1,Medio
Alquilo moderno departamento en Kennedy Norte Guayaquil,600,Guayas,"guayas, kennedy norte, guayaquil, ecuador",2,2,68.0,1,Económico
Se Renta Excelente Local Comercial Por Estrenar Sector San Gabriel,520,Pichincha,"pichincha, hernandez de giron, quito, ecuador",3,1,57.0,1,Medio
Arriendo Departamento Cerca Universidad Central,300,Pichincha,"pichincha, humberto albornoz, quito, ecuador",3,1,90.0,1,Medio
EN RENTA OFICINA – CONSULTORIO MÉDICO – LA PRADERA,265,Pichincha,"pichincha, alemania & av. eloy alfaro, quito, ecuador",3,1,34.0,1,Medio
EN RENTA DEPARTAMENTO AMOBLADO,350,Pichincha,"pichincha, antiguo aeropuerto, quito, ecuador",2,1,50.0,1,Medio
DEPARTAMENTO EN SAIBA,500,Guayas,"guayas, ciudadela saiba, guayaquil, ecuador",3,3,120.0,1,Medio
RENTA DEPARTAMENTO DE 2 DORMITORIOS URB. PUERTO AZUL VIA LA COSTA GUAYAQUIL ECUADOR,600,Guayas,"guayas, urbanizacion puerto azul, guayaquil, ecuador",2,4,68.0,1,Medio
Hermosa suite de arriendo con Línea blanca de oportunidad sector el bosque $480 incluido Alicuota,480,Pichincha,"pichincha, el bosque, quito, ecuador",1,2,70.0,1,Económico
Hermoso departamento de arriendo de oportunidad sector Hospital Metropolitano 3 dormitorios precio $450,450,Pichincha,"pichincha, hospital metropolitano, avenida mariana de jesus, quito, ecuador",3,2,97.0,1,Medio
Hermoso departamento de arriendo de oportunidad sector Pomasqui 2 dormitorios,280,Pichincha,"pichincha, pomasqui, quito, ecuador",2,1,80.0,1,Económico
SE RENTA LOCAL Y OFICINA EN BELLAVISTA DE CALDERON,690,Pichincha,"pichincha, bellavista, calderon, quito, ecuador",3,2,140.0,1,Medio
LOCAL GRANDE E IDEAL PARA FRANQUICIA o RESTAURANTE,3500,Pichincha,"pichincha, juan leon mera, quito, ecuador",3,3,410.0,1,Medio
DEPARTAMENTO EN SAIBA,500,Guayas,"guayas, ciudadela saiba, guayaquil, ecuador",3,2,150.0,1,Medio
SE ARRIENDA GALPON 390 M2 EN PONCEANO,1650,Pichincha,"pichincha, ponceano, ecuador",3,1,390.0,2,Lujo
SE RENTA SUITE 95m2 SECTOR BELLAVISTA,580,Pichincha,"pichincha, bellavista, quito, ecuador",1,2,95.0,1,Económico
OFICINA EN RENTA A POCOS METROS DEL SAN LUIS,350,Pichincha,"pichincha, av san luis, quito, ecuador",1,1,50.0,1,Medio
Departamento 3 dormitorios en Arriendo,350,Pichincha,"pichincha, nunez de bonilla 286-340, quito, ecuador",3,2,140.0,1,Medio
DEPARTAMENTO EN ARRIENDO SAIBA,500,Guayas,"guayas, ciudadela saiba, guayaquil, ecuador",3,2,120.0,1,Medio
ARRIENDO O VENDO 1600 m2 GALPON COMERCIAL,3500,Pichincha,"pichincha, bellavista y las lagunas, quito, ecuador",3,6,1600.0,22,Medio
"2 DORMITORIOS, PLANTA BAJA",200,Pichincha,"pichincha, chontamarca, ecuador",2,1,100.0,1,Medio
Departamento amoblado de Renta en la Coruña,1100,Pichincha,"pichincha, avenida la coruna & valladolid, quito, ecuador",3,2,100.0,1,Medio
Oficina en renta Sector la Carolina,700,Pichincha,"pichincha, avenida republica del salvador, quito, ecuador",1,1,58.0,1,Lujo
OFICINA EN RENTA SECTOR LA COLÓN,220,Pichincha,"pichincha, av. 10 de agosto & javier ascazubi, quito, ecuador",1,1,60.0,1,Económico
OFICINA IDEAL REACTIVATE- LA COLÓN,300,Pichincha,"pichincha, av. 10 de agosto & javier ascazubi, quito, ecuador",1,1,80.0,1,Lujo
BONITO LOCAL COMERCIAL DE ALQUILER CAPELO,120,Pichincha,"pichincha, capelo, quito, ecuador",3,1,30.0,2,Económico
Departamento 2D Renta sector La Kennedy,220,Pichincha,"pichincha, la kennedy, quito, ecuador",2,1,45.0,1,Económico
HERMOSO LOFT DE ARRIENDO EN LA LEONIDAS PLAZA,500,Pichincha,"pichincha, leonidas plaza gutierrez, quito, ecuador",1,1,17.0,1,Medio
EN RENTA LOCAL COMERCIAL SECTOR SAN RAFAEL,250,Pichincha,"pichincha, san rafael, ecuador",3,2,45.0,3,Económico
DE ALQUILER BODEGA EN EL COLIBRÍ,1000,Pichincha,"pichincha, sangolqui, sangolqui, ecuador",3,2,200.0,1,Lujo
Hostel en Renta Sector el Chaupi,700,Pichincha,"pichincha, el chaupi, el chaupi, ecuador",8,5,783.0,15,Medio
Departamento con Terraza Privada. Sector Mall del Sur .,300,Guayas,"guayas, ciudadela moran valverde",2,1,70.0,1,Medio
SE RENTA EDIFICIO SECTOR ESTRATEGICO EN LATACUNGA,3700,Cotopaxi,"cotopaxi, latacunga, cotopaxi, ecuador",3,2,100.0,1,Medio
SUITE AMOBLADA EN LA DIEGO DE ALMAGRO Y ALPALLANA,400,Pichincha,"pichincha, diego de almagro & alpallana, quito, ecuador",1,1,87.0,1,Económico
VENDO TERRENOS EN PUEMBO,125,Pichincha,"pichincha, puembo, ecuador",3,2,100.0,1,Económico
Bodega en Renta Parque industrial Sangolquí,2500,Pichincha,"pichincha, sangolqui, sangolqui, ecuador",3,2,640.0,1,Lujo
LOCAL U OFICINA EN EL EDIFICIO WORL TRADE CENTER,590,Pichincha,"pichincha, edificio world trade center, avenue 12 de octubre, quito, ecuador",3,2,75.0,1,Económico
DEPARTAMENTO DE ARRIENDO GONZALEZ SUAREZ,750,Pichincha,"pichincha, gonzalez suarez, quito, ecuador",4,4,200.0,1,Lujo
DEPARTAMENTO DE ARRIENDO EN COTOCOLLAO,300,Pichincha,"pichincha, cotocollao, quito, ecuador",3,2,120.0,1,Medio
SUITE DE ARRIENDO AMOBLADA,450,Pichincha,"pichincha, avenida republica del salvador, quito, ecuador",1,1,65.0,1,Económico
Arriendo departamento en el centro de Babahoyo,220,Los Rios,"los rios, calle 18 de mayo, babahoyo, ecuador",2,1,87.0,1,Económico
Departamento a estrenar en el centro de Babahoyo,240,Los Rios,"los rios, calle 18 de mayo, babahoyo, ecuador",2,1,90.0,1,Medio
ALQUILER DEPARTAMENTO CENTRO BABAHOYO,240,Los Rios,"los rios, calle 18 de mayo, babahoyo, ecuador",2,1,90.0,1,Medio
ARRIENDO CASA EN CUMBAYA COLEGIO MENOR,2600,Pichincha,"pichincha, cumbaya, quito, ecuador",4,4,470.0,6,Lujo
HERMOSA SUITE CON BALCÓN EN LA 12 DE OCTUBRE,550,Pichincha,"pichincha, av. 12 de octubre, quito, ecuador",1,1,87.0,1,Medio
HERMOSA SUITE FULL AMOBLADA EN LA GONZALEZ SUAREZ,500,Pichincha,"pichincha, gonzalez suarez, quito, ecuador",1,1,110.0,1,Medio
PISO EN RENTA PARA PEQUEÑA INDUSTRIA CHILLOGALLO,400,Pichincha,"pichincha, chillogallo, quito, ecuador",3,2,215.0,1,Lujo
"Departamento Dúplex de 3 dormitorios en conjunto residencial Sironi, Cumbayá",950,Pichincha,"pichincha, av. interoceanica 1/2, cumbaya, quito, ecuador",3,3,222.0,2,Medio
HERMOSA SUITE FULL AMOBLADA EN LA FLORESTA,430,Pichincha,"pichincha, la floresta, quito, ecuador",1,1,15.0,1,Medio
"ACOJEDOR DEPARTAMENTO AMOBLADO EN ALQUILER KENNEDY AV. SAN JORGE, 4 DORMITORIOS",610,Guayas,"guayas, kennedy, guayaquil, ecuador",4,4,205.0,1,Medio
ARRIENDO AMAZONAS CON VISTA AL PARQUE DE LA CAROLINA,500,Pichincha,"pichincha, av. rio amazonas, quito, ecuador",3,3,140.0,1,Medio
Se Renta Excelente Oficina en el en Edificio Corporativo ZYRA,800,Pichincha,"pichincha, avenida portugal, quito, ecuador",1,1,91.0,1,Lujo
"Villa En El Sur De Guayaquil, Ciudadela Del IESS, Atrás Del Hospital Teodoro Maldonado.",350,Guayas,"guayas, ciudadela del periodista, guayaquil, ecuador",3,1,91.0,1,Medio
En Renta oficina en el edificio World Trade Center,750,Pichincha,"pichincha, edificio world trade center, avenue 12 de octubre, quito, ecuador",3,2,65.0,1,Lujo
DEPARTAMENTO EN ARRIENDO CIUDADELA LA SAIBA,550,Guayas,"guayas, ciudadela saiba, guayaquil, ecuador",3,2,120.0,1,Lujo
DEPARTAMENTO DE ARRIENDO SECTOR GRANDA CENTENO,500,Pichincha,"pichincha, granda centeno, quito, ecuador",2,1,142.0,2,Medio
RENTO DEPARTAMENTO GRANDE SECTOR LA GASCA,330,Pichincha,"pichincha, la gasca, quito, ecuador",3,2,116.0,1,Económico
En Renta Lujosa Suite ubicada en el hotel MARRIOTT,1700,Pichincha,"pichincha, hotel marriott quito, avenida francisco de orellana, quito, ecuador",2,2,92.0,1,Medio
OPORTUNIDAD ÚNICA | LOTE PLAYERO A 5 MINUTOS DE PUERTO CAYO,6500,Manabí,"manabi, manta, ecuador",3,2,200.0,1,Medio
Hermoso departamento de arriendo con línea blanca sector el bosque $ 470 incluido alícuota,470,Pichincha,"pichincha, el bosque, quito, ecuador",2,2,90.0,1,Económico
Hermoso departamento de arriendo de oportunidad sector La prensa Av. el Maestro $320 incluido Alicuota,320,Pichincha,"pichincha, de la prensa y del maestro, quito, ecuador",2,2,110.0,1,Medio
Hermosa casa de arriendo de oportunidad $ 500 dólares sector Santa Lucía,500,Pichincha,"pichincha, santa lucia, quito, ecuador",3,3,150.0,1,Medio
ARRIENDO OFICINAS CON BODEGA SECTOR CALDERON,600,Pichincha,"pichincha, calderon, quito, ecuador",3,1,170.0,2,Medio
Hermosa casa en conjunto Cordillera,500,Pichincha,"pichincha, martin ochoa y av simon bolivar (occidental)",3,3,180.0,2,Medio
OFICINA DE ARRIENDO SECTOR LA MARISCAL,350,Pichincha,"pichincha, la mariscal, quito, ecuador",3,2,48.0,1,Medio
"Villa en el Sur de Guayaquil, Ciudadela Del IESS, atrás del Hospital Teodoro Maldonado.",400,Guayas,"guayas, av olmedo, guayaquil 090314, ecuador",3,1,91.0,1,Medio
Se Arriendan Departamentos- Ciudadela Las Orquídeas,200,Guayas,"guayas, avenida 1 49, las orquideas este, guayaquil, ecuador",2,2,80.0,1,Medio
Casa Independiente en Renta Sector Santa Ines Cumbayá,2600,Pichincha,"pichincha, santa ines, quito, ecuador",3,3,300.0,4,Medio
EN RENTA TERRENO COMERCIAL CERCA DE LA AV. ILALÓ,2500,Pichincha,"pichincha, av. ilalo, quito, ecuador",3,2,100.0,1,Medio
ESPACIOSO DEPARTAMENTO EN RENTA SECTOR BILOXI,280,Pichincha,"pichincha, biloxi, quito, ecuador",3,2,117.0,1,Medio
"RENTA DE SUITE SEMIAMOBLADA,CUMBAYA scala shopping",550,Pichincha,"pichincha, cumbaya, quito, ecuador",1,1,68.0,1,Económico
RENTO LOCAL COMERCIAL CON BODEGA EN CHILLOGALLO,300,Pichincha,"pichincha, chillogallo, quito, ecuador",3,2,37.0,1,Económico
EN RENTA CASA AMOBLADA EN EL CENTRO HISTORICO,1100,Pichincha,"pichincha, centro historico, quito, ecuador",4,4,700.0,1,Lujo
"Arriendo Suite Amoblada, La Mariscal",450,Pichincha,"pichincha, la mariscal, quito, ecuador",1,2,60.0,1,Medio
Arriendo departamento sector cultural La Floresta,425,Pichincha,"pichincha, avenida ladron de guevara & barcelona, quito, ecuador",2,2,90.0,1,Medio
EN RENTA LOCAL COMERCIAL AV. PRINCIPAL CAPELO,300,Pichincha,"pichincha, capelo, quito, ecuador",3,2,70.0,1,Lujo
EN RENTA OFICINA SECTOR DEL COLIBRÍ-SANGOLQUÍ,180,Pichincha,"pichincha, el colibri, avenida general ruminahui, sangolqui, ecuador",3,2,27.0,1,Económico
EN RENTA OFICINA SECTOR DEL COLIBRÍ-SANGOLQUÍ,160,Pichincha,"pichincha, el colibri, avenida general ruminahui, sangolqui, ecuador",3,2,24.0,1,Económico
Suite sector universidad Católica,350,Pichincha,"pichincha, toledo & madrid, quito 170143, ecuador",1,1,70.0,1,Medio
EXCELENTE UBICACION LOCAL COMERCIAL RENTA (118M2 – RUMIPAMBA),850,Pichincha,"pichincha, veracruz & avenida de la republica, quito, ecuador",3,2,118.0,2,Medio
CASA COMERCIAL EXCELENTE UBICACION RENTA (200M2 – RUMIPAMBA),1500,Pichincha,"pichincha, veracruz & avenida de la republica, quito, ecuador",5,2,200.0,3,Lujo
BODEGA COMERCIAL UBICACION ESTRATEGICA DE RENTA (87M2 – RUMIPAMBA),450,Pichincha,"pichincha, veracruz & avenida de la republica, quito, ecuador",1,1,87.0,1,Económico
LOCAL EN RENTA A ESTRENAR DE 26M2 (EDF. AMELIA) MASTODONTES,200,Pichincha,"pichincha, mastodontes, quito, ecuador",1,1,26.0,1,Medio
"Arriendo Departamento 3 Dormitorios, La Mariscal",697,Pichincha,"pichincha, la mariscal, quito, ecuador",3,2,110.0,2,Lujo
CONFORTABLE DEP. EXCELENTE UBICACION RENTA (75 MT2) RUMIPAMBA,300,Pichincha,"pichincha, antonio de ulloa & avenida atahualpa, quito, ecuador",2,2,75.0,1,Medio
DEPARTAMENTO EN RENTA,450,Pichincha,"pichincha, nunez de vela & juan jose de villalengua, quito, ecuador",2,2,95.0,1,Medio
Casa en Renta 2 pisos – Quito,350,Pichincha,"pichincha, rio peripa, quito, ecuador",3,2,90.0,1,Medio
SE VENDEN EXCELENTES LOTES DE TERRENO COMERCIALES EN LA VIA EL CAMBIO CERCA AL PARQUE EN LA VIA PRINCIPAL,125,El Oro,"el oro, el cambio, machala, ecuador",10,10,5970.0,20,Medio
"Arriendo Suite Amoblada, Av. America, Rumipamba",340,Pichincha,"pichincha, av. america, quito, ecuador",1,1,50.0,1,Medio
SE VENDEN DOS LOTES DE TERRENOS COMERCIALES EN LA PARROQUIA EL CAMBIO FRENTE A LA VIA PRINCIPAL,125,El Oro,"el oro, parroquia el cambio, machala",3,2,5970.0,10,Medio
Renta de Suite Semi – Amoblada Sector La Carolina,550,Pichincha,"pichincha, la carolina, quito, ecuador",1,1,70.0,1,Medio
Renta de Consultorio Sector Eloy Alfaro y Alemania,500,Pichincha,"pichincha, fortune plaza business center, avenida eloy alfaro, quito, ecuador",3,1,45.0,1,Medio
Renta Oficina Sector La Carolina,750,Pichincha,"pichincha, avenida republica del salvador & avenida de los shyris, quito, ecuador",3,1,80.0,1,Medio
Departamento en Venta/renta Sector Real Audiencia,517,Pichincha,"pichincha, real audiencia, quito, ecuador",2,2,96.0,1,Medio
LINDA OFICINA EN LA AV. COLON Y AMAZONAS ARRIENDO,350,Pichincha,"pichincha, av. cristobal colon & avenida rio amazonas, quito, ecuador",3,2,51.0,1,Medio
"Arriendo Departamento 3 Dormitorios + Estudio, La Mariscal",550,Pichincha,"pichincha, la mariscal, quito, ecuador",3,3,140.0,1,Medio
EN RENTA OFICINA EN EL CENTRO DE SANGOLQUÍ OFICINA 4,130,Pichincha,"pichincha, sangolqui, sangolqui, ecuador",3,2,28.0,1,Económico
EN RENTA OFICINA EN EL CENTRO DE SANGOLQUÍ OFICINA 3,170,Pichincha,"pichincha, sangolqui, sangolqui, ecuador",3,2,52.0,1,Medio
EN RENTA OFICINA EN EL CENTRO DE SANGOLQUÍ OFICINA 2,120,Pichincha,"pichincha, sangolqui, sangolqui, ecuador",3,2,23.0,1,Económico
EN RENTA OFICINA EN EL CENTRO DE SANGOLQUÍ OFICINA 1,140,Pichincha,"pichincha, sangolqui, sangolqui, ecuador",3,2,30.0,1,Económico
EN RENTA OFICINA EN EL CENTRO DE SANGOLQUÍ,150,Pichincha,"pichincha, sangolqui, sangolqui, ecuador",3,2,38.0,1,Medio
TERRENO EN VENTA COLINAS DE BRICENO TERRENO 1,6500,Manabí,"manabi, san vicente, ecuador",3,2,100.0,1,Medio
EN RENTA NAVE INDUSTRIAL – VÍA SANGOLQUÍ AMAGUAÑA,3000,Pichincha,"pichincha, amaguana, quito, ecuador",3,2,600.0,1,Medio
Local de Arriendo ubicado en el Colibri,600,Pichincha,"pichincha, el colibri, avenida general ruminahui, sangolqui, ecuador",3,2,100.0,1,Medio
SE RENTA DE SUITE EN LA PRIMAVERA,450,Pichincha,"pichincha, la primavera, quito, ecuador",1,1,45.0,1,Económico
LOCAL COMERCIAL DE RENTA GUAMANÍ SUR DE QUITO,3900,Pichincha,"pichincha, guamani, quito, ecuador",3,2,286.0,12,Medio
