titulo,precio,provincia,lugar,num_dormitorios,num_banos,area,num_garages,tipo_precio_lugar
"APARTAMENTOS, SUITES Y HABITACIONES AMOBLADAS Y EQUIPADAS DE ARRIENDO",400,Pichincha,"pichincha, francisco robles e2-07 y paez , quito, ecuador",3,2,100.0,1,Medio
Hermoso departamento de arriendo Ponceano alto de oportunidad,450,Pichincha,"pichincha, ponceano alto, quito, ecuador",3,3,125.0,1,Medio
Hermosa suite de lujo de arriendo por estrenar 6 de Diciembre,570,Pichincha,"pichincha, 6 de diciembre, quito, ecuador",1,2,75.0,1,Medio
Hermosa casa de arriendo por estrenar Pomasqui,400,Pichincha,"pichincha, pomasqui, quito, ecuador",3,3,95.0,1,Medio
Hermosa suite por estrenar Monteserrin ecopark de oportunidad,500,Pichincha,"pichincha, monteserrin, quito, ecuador",1,2,75.0,1,Medio
Arriendo departamento en Tonsupa Esmeraldas,508,Esmeraldas,"esmeraldas, av. club del pacifico, tonsupa, ecuador",3,3,140.0,1,Medio
Departamento de arriendo al Norte de Quito,350,Pichincha,"pichincha, pedro garcia moreno, quito, ecuador",3,3,110.0,1,Medio
SE ARRIENDA LOCAL COMERCIAL/ OFICINA / CONSULTORIO – SECTOR 9 DE OCTUBRE,245,Pichincha,"pichincha, 9 de octubre & avenida eloy alfaro, quito, ecuador",2,1,49.0,1,Medio
Hermoso departamento de arriendo en Quito tenis,1100,Pichincha,"pichincha, quito tenis, quito, ecuador",4,4,300.0,2,Medio
Hermoso departamento de arriendo sector Quito Tennis de oportunidad,450,Pichincha,"pichincha, quito tenis, quito, ecuador",2,2,90.0,1,Económico
Hermoso departamento de arriendo de oportunidad $420 sector Brasil,420,Pichincha,"pichincha, avenida brasil, quito, ecuador",2,1,90.0,1,Económico
Hermosa casa de arriendo sector colegio sek,600,Pichincha,"pichincha, colegio internacional sek - ecuador, de los guayacanes, quito, ecuador",3,3,160.0,2,Medio
Hermoso departamento duplex de arriendo de oportunidad Ponceano Alto,500,Pichincha,"pichincha, ponceano alto, quito, ecuador",3,3,196.0,3,Lujo
Hermoso departamento de arriendo sector Ponceano alto,280,Pichincha,"pichincha, ponceano alto, quito, ecuador",2,2,85.0,1,Económico
Hermoso departamento de arriendo de oportunidad González Suárez,550,Pichincha,"pichincha, gonzalez suarez, quito, ecuador",2,2,100.0,2,Medio
Hermoso departamento de arriendo de oportunidad sector El Pinar,350,Pichincha,"pichincha, el pinar, quito, ecuador",3,2,90.0,1,Medio
Casa con LOCAL COMERCIAL en arriendo – Mitad del Mundo,690,Pichincha,"pichincha, mitad del mundo, 5, quito, ecuador",3,2,311.0,1,Medio
Hermoso departamento de arriendo sector Granda Centeno de oportunidad,530,Pichincha,"pichincha, granda centeno, quito, ecuador",2,2,90.0,1,Lujo
Hermoso departamento de arriendo sector Quicentro norte,600,Pichincha,"pichincha, quicentro shopping, avenida de los shyris, quito, ecuador",2,3,110.0,2,Medio
Hermosa suite amoblada sector Bosque de oportunidad,500,Pichincha,"pichincha, el bosque, quito, ecuador",1,2,75.0,1,Medio
Alquilo Departamento de 2 Dormitorios en Nva. Kennedy,300,Guayas,"guayas, pichincha, 6o pasaje 9 no kennedy guayaquil guayaquil",2,2,64.0,0,Medio
Alquilo Suite de 2 Ambientes en Nva. Kennedy,200,Guayas,"guayas, 6o pasaje 9 no, guayaquil 090512, ecuador",1,1,24.0,0,Medio
Alquilo Dpto de 3 Dormitorios en Nva. Kennedy,400,Guayas,"guayas, 6o pasaje 9 no kennedy guayaquil guayaquil",3,2,96.0,0,Medio
"Alquilo City Suites Departamento Amoblado, Guayaquil",600,Guayas,"guayas, city suites - luxury, avenida benjamin carrion mora, guayaquil, ecuador",1,1,38.0,1,Medio
"Alquiler Departamento Samanes, Norte de Guayaquil",350,Guayas,"guayas, avenida 1c ne samanes guayaquil guayaquil",2,2,100.0,0,Medio
"Alquilo Las Cumbres, Ceibos, Guayaquil",850,Guayas,"guayas, urbanizacion las cumbres, guayaquil, ecuador",3,4,200.0,2,Medio
Hermoso departamento de arriendo amoblado República del Salvador Amoblado,750,Pichincha,"pichincha, naciones unidas y republica del salvador, quito, ecuador",2,3,100.0,1,Económico
Hermoso departamento de arriendo amoblado sector Brasil,500,Pichincha,"pichincha, avenida brasil, quito, ecuador",2,3,100.0,1,Lujo
Hermoso departamento de arriendo Ponceano alto de oportunidad,450,Pichincha,"pichincha, poceano quito",3,3,100.0,2,Medio
Hermoso departamento de arriendo sector Quicentro norte,620,Pichincha,"pichincha, quicentro shopping, avenida de los shyris, quito, ecuador",2,3,120.0,2,Lujo
Arriendo departamento en Condominios el Inca,280,Pichincha,"pichincha, de los colimes esq, quito 170125, ecuador",3,1,64.0,1,Medio
"Suite en alquiler, sector Plaza Artigas",400,Pichincha,"pichincha, destruge, quito 170109, ecuador",1,1,56.84,1,Medio
"Oficina en renta, sector Hotel Quito-Av. 12 de Octubre",2000,Pichincha,"pichincha, la paz, quito, ecuador",3,3,208.95,4,Medio
"Local comercial en alquiler, sector Iñaquito",800,Pichincha,"pichincha, juan gonzalez, quito, ecuador",3,1,60.0,0,Medio
"Depto de lujo, excelente vista y ubicacion.",400,Pichincha,"pichincha, calle b, quito 170132, ecuador",1,2,97.0,1,Medio
"COD # 081 VENTA DE MACRO LOTE DE OPORTUNIDAD, EN CHANDUY, FRENTE AL MAR.",9,Santa Elena,"santa elena, chanduy, ecuador",3,2,200000.0,1,Medio
Hermosa casa de arriendo de oportunidad sector Pomasqui $350,350,Pichincha,"pichincha, pomasqui, quito, ecuador",3,3,103.0,2,Medio
Hermoso departamento de arriendo de oportunidad sector Union nacional bosque,450,Pichincha,"pichincha, union nacional de periodistas, quito, ecuador",3,3,130.0,1,Medio
Hermoso departamento de lujo en. Arriendo sector el bosque,500,Pichincha,"pichincha, el bosque, quito, ecuador",2,2,103.0,1,Medio
Rento Casa Av Intervalles,1400,Pichincha,"pichincha, av. intervalles, ecuador",3,2,100.0,1,Medio
"LAVISTA TOWERS, 50XDIA, 300XSEMANA, 550XQUINCENA, 1000XMES, SEGURIDAD Y PRIVACIDAD.",1000,Guayas,"guayas, los alamos alamos guayaquil guayas",2,2,70.0,1,Medio
Hermoso departamento de arriendo duplex sector Ponceano alto,400,Pichincha,"pichincha, ponceano alto, quito, ecuador",2,2,85.0,1,Medio
Hermoso departamento de arriendo sector Gonzales Suárez,750,Pichincha,"pichincha, gonzalez suarez, quito 170517, ecuador",2,2,130.0,1,Medio
Rento casa comercial sector 12 de octubre ideal para restaurantes,2500,Pichincha,"pichincha, avenue 12 de octubre, quito, ecuador",4,4,500.0,8,Medio
Arriendo dos locales de oportunidad sector plaza de toros isla floreana,1100,Pichincha,"pichincha, avenida isla floreana, quito, ecuador",3,2,170.0,3,Medio
Hermoso departamento por estrenar sector Portugal,550,Pichincha,"pichincha, avenida portugal, quito, ecuador",2,2,95.0,1,Económico
Renta Departamento 2 Habitaciones Republica del Salvador SECTOR QUICENTRO,650,Pichincha,"pichincha, av republica de el salvador, quito 170102, ecuador",2,2,109.0,1,Medio
"Departamento de arriendo, Rep. del Salvador, 120 mts, $ 600 JD",600,Pichincha,"pichincha, av republica de el salvador la carolina quito distrito metropolitano de quito",2,3,120.0,1,Medio
DEPARTAMENTO DE DOS HABITACIONES SECTOR CAROLINA,650,Pichincha,"pichincha, la carolina, quito, ecuador",2,2,85.0,2,Medio
DEPARTAMENTO EN RENTA 160M2 GASPAR DE VILLAROEL $600,600,Pichincha,"pichincha, av. 6 de diciembre, quito, ecuador",3,2,100.0,1,Medio
DEPARTAMENTO FRENTE AL C.C.EL BOSQUE 242M2,1200,Pichincha,"pichincha, el bosque, quito, ecuador",3,3,242.0,3,Lujo
OFICINA SECTOR GRANDA CENTENO $550,550,Pichincha,"pichincha, granda centeno, quito 170521, ecuador",5,3,200.0,1,Medio
SUITE AMOBLADO 60M2 SECTOR 12 DE OCTUBRE EN RENTA.,530,Pichincha,"pichincha, ave 12 de octubre, quito, ecuador",1,1,60.0,1,Medio
"Puerto Azul, Departamento en Alquiler",600,Guayas,"guayas, via a la costa, ecuador",2,2,77.0,1,Medio
"Urdesa Central, Suite Amoblada",400,Guayas,"guayas, urdesa central, guayaquil 090511, ecuador",1,1,45.0,1,Medio
"RENTA MODERNO DEPARTAMENTO, SECTOR CENTRO NORTE, CATALINA ALDAZ",650,Pichincha,"pichincha, catalina aldaz",2,2,100.0,1,Medio
"Hm/ San Carlos, 300 Usd! Departamento 2 Habitaciones de 60 m² en Arriendo.",300,Pichincha,"pichincha, la concepcion quito distrito metropolitano de quito pichincha",2,1,60.0,1,Medio
"Renta Suite Amoblada, Carolina, Sector Centro Norte",470,Pichincha,"pichincha, corea, quito 170102, ecuador",1,1,62.0,1,Medio
"Rento Departamento, Cerca Plataforma Gubernamental, Sector Centro Norte",475,Pichincha,"pichincha, japon, quito 170102, ecuador",2,1,90.0,1,Medio
"Rento Departamento Amoblado, Sector Republica del Salvador",850,Pichincha,"pichincha, av republica de el salvador, quito 170102, ecuador",3,3,110.0,1,Medio
"Arriendo Oficina Amoblada, Sector Mall El Jardin, Av Amazonas",400,Pichincha,"pichincha, av. amazonas, quito, ecuador",3,1,50.0,1,Medio
"Rento Oficina Moderna Amoblada, Sector Pradera",850,Pichincha,"pichincha, mariana de jesus, quito, ecuador",3,1,75.0,2,Medio
"Rento Bonita Suite Amoblada, Republica del Salvador",480,Pichincha,"pichincha, av republica de el salvador, quito 170102, ecuador",1,2,61.0,1,Económico
"Rento Local Comercial Sector Centro Norte, Granados",1500,Pichincha,"pichincha, de los granados, quito, ecuador",4,3,150.0,0,Lujo
"RENTO SUITE MODERNA, TOTALMENTE AMOBLADA Y EQUIPADA.. CAROLINA",690,Pichincha,"pichincha, av. portugal, quito 170102, ecuador",1,2,60.0,1,Medio
"DEPARTAMENTO AMOBLADO EN RENTA TRES DORMITORIOS, REPÚBLICA DE EL SALVADOR",850,Pichincha,"pichincha, av republica de el salvador, quito 170102, ecuador",3,4,130.0,1,Medio
SUITE SEMIAMOBLADA EN RENTA. QUITO TENIS $360,360,Pichincha,"pichincha, hidalgo de pinto chaupicruz quito distrito metropolitano de quito",1,1,70.0,1,Medio
Departamento en Arriendo Bellavista,550,Pichincha,"pichincha, ignacio bossano & avenida 6 de diciembre, quito 170102, ecuador",2,2,69.0,1,Medio
Departamento en Venta – Arriendo Carcelén/Mastodontes,300,Pichincha,"pichincha, jaime roldos aguilera & calle e, quito, ecuador",2,2,84.0,1,Medio
Alquiló local en la 10 de Agosto y Mariana de Jesús,850,Pichincha,"pichincha, 10 de agosto y mariana de jesus",3,2,140.0,1,Medio
RENTO OFICINA EN SECTOR CAROLINA,750,Pichincha,"pichincha, tamayo & avenida 6 de diciembre, quito 170102, ecuador",4,2,96.0,2,Medio
ARRIENDO DEPARTAMENTO AMOBLADO,819,Pichincha,"pichincha, finlandia & suecia, quito, ecuador",2,3,100.0,1,Medio
"Rento Oficina comercial Torre Boreal, Av. 12 de Octubre y Av. Colon, sector La Floresta",400,Pichincha,"pichincha, n24-739 avenue 12 de octubre mariscal sucre quito",3,1,60.0,1,Medio
ALQUILO SUITE TEMPORAL EN AV REPÚBLICA DEL SALVADOR,1000,Pichincha,"pichincha, av. republica del salvador y moscu",1,1,70.0,1,Medio
EDIFICIO EN RENTA,9000,Pichincha,"pichincha, avenida 10 de agosto, quito, ecuador",0,6,4000.0,20,Medio
CASA PARA OFICINAS EN RENTA,2100,Pichincha,"pichincha, sector plataforma financiera norte",6,5,460.0,5,Medio
Casa en renta valle La ESPE,600,Pichincha,"pichincha, sangolqui, ecuador",3,2,100.0,1,Lujo
Hermoso departamento excelente sector Ponceano,500,Pichincha,"pichincha, ponceano",3,2,100.0,1,Medio
Hermosa casa De oportunidad 3 dormitorios excelente sector Ponceano Alto,480,Pichincha,"pichincha, ponceano alto, quito, ecuador",3,3,150.0,1,Lujo
Hermosa casa excelente sector colegio SEK quito,600,Pichincha,"pichincha, de los guayacanes n51, quito 170124, ecuador",4,3,200.0,2,Medio
Hm/ Sector La Pradera Usd 520 Se Arrienda Hermosa Suite Amoblada de 46 m².,520,Pichincha,"pichincha, diego de almagro la pradera quito distrito metropolitano de quito",1,1,46.0,1,Medio
Hm/amazonas en Renta 100 m² – Mariscal Sucre Usd 850,850,Pichincha,"pichincha, av. gral. ignacio de veintimilla & av. amazonas, quito 170143, ecuador",2,2,100.0,0,Medio
Hermoso departamento 2 Dormitorios excelente sector CCI,500,Pichincha,"pichincha, centro comercial inaquito (cci), quito, ecuador",2,2,100.0,1,Medio
ARRIENDO CAROLINA 3 DORMITORIOS 105 M2 $600,600,Pichincha,"pichincha, av. eloy alfaro & av. de los shyris, quito 170102, ecuador",3,2,105.0,1,Medio
VENDO O ARRIENDO QUINTA EN TUMBACO ARENAL HILACRYL,1200,Pichincha,"pichincha, aurelio davila cajas, quito, ecuador",3,2,300.0,4,Medio
"Se alquila suite segura, cómoda y económica",165,Guayas,"guayas, urbanor, guayaquil 090510, ecuador",1,1,32.0,0,Medio
Arriendo Dep. Cumbaya,300,Pichincha,"pichincha, rodrigo nunez, quito 170184, ecuador",2,1,100.0,1,Medio
Hermoso departamento de alquiler Sector El Batan,700,Pichincha,"pichincha, el batan, quito, ecuador",2,2,100.0,2,Medio
"Suite de alquiler amoblada en el Batan, ideal para estudiante!",500,Pichincha,"pichincha, el batan, quito, ecuador",1,1,60.0,1,Económico
Hermoso departamento de alquiler en el Batan,700,Pichincha,"pichincha, el batan, quito, ecuador",3,2,115.0,2,Medio
Hermoso Suite Loft amoblado de alquiler sector Whimper,550,Pichincha,"pichincha, whymper, quito, ecuador",1,2,74.0,1,Medio
Departamento de alquiler Urbanización El Condado,680,Pichincha,"pichincha, urbanizacion el condado, calle c, quito, ecuador",3,3,210.0,2,Lujo
De Oportunidad casa de alquiler Urbanización El Condado SIN MUEBLES,750,Pichincha,"pichincha, calle c, quito 170134, ecuador",3,3,254.0,2,Lujo
Alquiler suite de lujo sector El Bosque,550,Pichincha,"pichincha, el bosque, quito, ecuador",1,2,70.0,2,Medio
Arriendo Departamento en González Suárez,500,Pichincha,"pichincha, gonzalez suarez, quito, ecuador",3,3,131.0,1,Medio
Arriendo Oficina Amoblada,500,Pichincha,"pichincha, quito, ecuador",3,1,60.0,2,Lujo
Arriendo o vendo amplia casa en San Rafael,3000,Pichincha,"pichincha, avenida general enriquez & isla san cristobal, quito, ecuador",7,7,770.0,3,Medio
RENTA DEPARTAMENTO PONCIANO ALTO,490,Pichincha,"pichincha,",3,2,180.0,1,Medio
Arriendo Suite Amoblada Estreno Carolina,600,Pichincha,"pichincha, avenida eloy alfaro, quito, ecuador",1,1,57.0,1,Medio
Arriendo Suite Amoblada República del Salvador,500,Pichincha,"pichincha, la carolina quito distrito metropolitano de quito pichincha",1,1,65.0,1,Medio
Amplio departamento de alquiler Urbanización El Condado,500,Pichincha,"pichincha, calle c, quito 170134, ecuador",3,3,150.0,2,Económico
Departamento de arriendo Sector El Bosque,850,Pichincha,"pichincha, el bosque, quito, ecuador",3,2,140.0,2,Lujo
Departamento de alquiler sector La Carolina por estrenar,800,Pichincha,"pichincha, la carolina, quito, ecuador",3,3,127.0,2,Lujo
Casa de alquiler en Santa Lucia,550,Pichincha,"pichincha, santa lucia, quito, ecuador",4,3,160.0,1,Medio
Céntrico departamento en arriendo Sector La Carolina,650,Pichincha,"pichincha, la carolina, quito, ecuador",2,2,100.0,1,Medio
Hermosa Casa de Lujo con piscina independiente de arriendo en Pusuqui,2500,Pichincha,"pichincha, pusuqui, quito, ecuador",4,5,700.0,5,Económico
SUITE DE ALQUILER AMOBLADA SECTOR MALL DEL SOL,800,Guayas,"guayas, av de las americas, guayaquil 090513, ecuador",1,1,80.0,1,Medio
SUITE DE ALQUILER TOTALMENTE AMOBLADA SECTOR MALL DEL SOL,800,Guayas,"guayas, av de las americas, guayaquil, ecuador",1,1,85.0,1,Medio
Lindo departamento semi amoblado de arriendo Sector Monteserrin,800,Pichincha,"pichincha, monteserrin, quito, ecuador",3,4,138.0,2,Lujo
De oportunidad Galpón de arriendo Sector Pusuqui,4500,Pichincha,"pichincha, pusuqui, quito, ecuador",3,2,1000.0,3,Lujo
Amplia y hermosa oficina en alquiler sector Batán bajo,700,Pichincha,"pichincha, batan bajo, quito, ecuador",5,1,180.0,1,Lujo
De oportunidad terreno en arriendo Sector Ponceano,1500,Pichincha,"pichincha, ponciano alto, quito, ecuador",3,2,100.0,1,Lujo
Amplio departamento amoblado en alquiler Sector Quito Tenis,1200,Pichincha,"pichincha, quito tenis, quito, ecuador",3,3,190.0,2,Lujo
Almacén de 2 plantas en arriendo Sector Calderón,4900,Pichincha,"pichincha, calderon, quito, ecuador",3,2,700.0,1,Lujo
Precioso Departamento en alquiler Sector El Batán,740,Pichincha,"pichincha, el batan, quito, ecuador",3,3,140.0,2,Lujo
Céntrico departamento en arriendo Sector República del Salvador,780,Pichincha,"pichincha, naciones unidas y republica del salvador, quito, ecuador",3,2,183.0,2,Lujo
Departamento de alquiler en Sector Quito Tenis,1700,Pichincha,"pichincha, quito tenis, quito, ecuador",3,3,271.0,2,Lujo
Hermoso departamento de alquiler Sector El Condado,550,Pichincha,"pichincha, urbanizacion el condado, calle c, quito, ecuador",2,2,115.0,2,Económico
